{"result_id": "222026", "URL": "https://newsinsideout.com/2020/11/international-tribunal-indicts-pandemic-defendants-that-distribute-covid-vaccines-and-rollout-5g-installations-that-allegedly-cause-dna-damage-and-emf-vaccine-genocide/", "timestamp": "2023-04-25 16:35:21 CEST+0200", "meta": {"description": "", "lang": "en", "keywords": "", "favicon": "https://newsinsideout.com/wp-content/uploads/2015/09/cropped-Favicon2-32x32.png", "canonical": "https://newsinsideout.com/2020/11/international-tribunal-indicts-pandemic-defendants-that-distribute-covid-vaccines-and-rollout-5g-installations-that-allegedly-cause-dna-damage-and-emf-vaccine-genocide/", "encoding": "UTF-8"}, "image": null, "domain": "newsinsideout.com", "title": "International Tribunal Indicts Pandemic defendants that distribute COVID vaccines and rollout 5G installations that allegedly cause DNA damage and EMF/vaccine genocide", "cleaned_text": "International Tribunal Indicts Pandemic defendants that distribute COVID vaccines and rollout 5G installations that allegedly cause DNA damage and EMF/vaccine genocide\n\nVANCOUVER, BRITISH COLUMBIA \u2013 In a 108-page PDF Indictment downloadable at the Tribunal Website, 29 Tribunal Judges of the Natural and Common Law Tribunal for Public Health and Justice hailing from four continents have indicted high profile Pandemic defendants that distribute COVID vaccines and rollout 5G installations that allegedly cause DNA damage and EMF/vaccine genocide, and summonsed them to a November 29, 2020 virtual trial.\n\u2022 Indicted Heads of Government ranging from Xi JinPing, Core Leader of China; Vladimir Putin, President of Russia [who plans to distribute 200 million potentially DNA damaging COVID vaccination doses to Latin America]; President Donald J. Trump, prime mover of Operation Warp Speed that plans to distribute 300 million doses of potentially DNA damaging COVID vaccines to Americans; the 46th President-Elect of the USA; Justin Trudeau and Boris Johnson, PMs of Canada and UK, who each plan to distribute hundreds of millions of doses of potentially DNA damaging COVID vaccines to the human beings in their nations.\n\u2022 NGOs such as the World Economic Forum, the Rockefeller Foundation, the Bill and Melinda Gates Foundation that are masterminding a 2010-2020 Lockstep Reset for self-enrichment and the destruction of fundamental human and constitutional rights, and Financial institutions such as the Bank for International Settlements, and the Federal Reserve System that are facilitating this Reset.\n\u2022 Major Vaccination regulators like the World Health Organization (WHO) and vaccination companies including Pfizer, Moderna, and Merck & Co., and\n\u2022 5G regulators like the FCC, OFCOM UK, International Commission on Non-Ionizing Radiation Protection, as well as\n\u2022 5G entrepreneurs including Elon Musk, Bill and Melinda Gates, and telecommunication companies such as Samsung Electronics, Huawei Technologies, Ericsson, Qualcomm, Nokia, ZTE Corporation, NEC Corporation, Verizon, Orange Mobile, TeleSystems, AT&T, Cisco, Systems, LG U+, South Korea telecom, Telstra Australia, Vodafone UK, Sprint USA, T-Mobile USA, Reliance, JIO India and others.\n\nAt the November 29, 2020 virtual Trial, the Tribunal seeks:\n\u2022 Emergency Injunctions stopping all 5G rollouts, all COVID 19 vaccinations, any and vaccinations, use of Aspartame in vaccinations and all consumer products, Lockdowns, Detentions, Concentration camps, and a planned Reset on grounds of immediate and irreparable harm from Genocide and Crimes Against Humanity being caused to humanity.\n\u2022 Emergency Writs of Mandamus, clawing back Unjust Enrichment by Pandemic Profiteers. For example: Unjust Enrichment during the Pandemic \u2013\n\u2022 Jeff Bezos (Amazon)increase = $36.2 billion Mark Zuckerberg (Facebook)increase = $30.1 billion\n\n Elon Musk (Space X)increase = $14.1 billion Sergey Steve Brin(Google)increase = $13.9 billion\n\n Larry Page (Google)= $13.7 billion Steve Ballmer (Microsoft)= $13.3 billion\n\n MacKenzie Bezos (Amazon)= $12.6 billion Michael Bloomberg (Bloomberg)= $12.1 billion Bill Gates (Microsoft/BMGF)= $11.8 billion Larry Ellison (Oracle)= $8.5 billion\n\n Mark Zuckerberg \u2013 From March 18 to June 4 Zuckerberg increased his wealth 52% to over $83 billion, according to the report. CNBC\n\n According to that report, the total net worth of America\u2019s billionaires rose 15% during the two months, from $2.9 trillion to $3.4 trillion. FORBES\n\n Jeff Bezos, founder and CEO of Amazon, was the biggest winner as his fortune grew by $36.2 billion to $202 billion between March 18 and June 4, IPS said. BUSINESS INSIDER\n\nInternational Tribunal Indicts Pandemic defendants that distribute COVID vaccines and rollout 5G installations that allegedly cause DNA damage and EMF/vaccine genocide\n\nwww.TrueTube.co\n\n www.NewsInsideOut.com\n\n Alfred Lambremont Webre Contact/News:\n\n news@newsinsideout.com\n\n The views expressed by guests are their own.\n\n Copyright 2020-22 NewsInsideOut.com All rights reserved. Please include a courtesy link back to this original article with any sharing of this article. Thank you.", "opengraph": {"locale": "en_US", "type": "article", "title": "International Tribunal Indicts Pandemic defendants that distribute COVID vaccines and rollout 5G installations that allegedly cause DNA damage and EMF/vaccine genocide - NewsInsideOut", "description": "International Tribunal Indicts Pandemic defendants that distribute COVID vaccines and rollout 5G installations that allegedly cause DNA damage and EMF/vaccine genocide International Tribunal Indicts Pandemic defendants that distribute COVID vaccines and rollout 5G installations that allegedly cause DNA damage and EMF/vaccine genocide VANCOUVER, BRITISH COLUMBIA \u2013 In a 108-page PDF Indictment downloadable at the Tribunal [\u2026]", "url": "https://newsinsideout.com/2020/11/international-tribunal-indicts-pandemic-defendants-that-distribute-covid-vaccines-and-rollout-5g-installations-that-allegedly-cause-dna-damage-and-emf-vaccine-genocide/", "site_name": "NewsInsideOut", "article:publisher": "https://www.facebook.com/NewsInsideOut", "article:author": "https://www.facebook.com/profile.php?id=100001662284456", "article:published_time": "2020-11-17T22:50:07+00:00", "article:modified_time": "2021-06-23T20:43:00+00:00", "image": "https://newsinsideout.com/wp-content/uploads/2014/12/FBBlackHelo.png", "image:width": "851", "image:height": "315", "image:type": "image/png"}, "tags": ["AT&T", "Samsung Electronics", "Elon Musk", "Reliance", "Ericsson", "Bill and Melinda Gate", "International Tribunal", "Pfizer", "Telstra Australia", "and Merck & Co", "President of Russia", "that allegedly cause DNA damage", "Vodafone UK", "Cisco", "and rollout 5G installations", "JIO India", "TeleSystems", "Verizon", "Donald Trump", "NEC Corporation", "ZTE Corporation", "Qualcomm", "Nokia", "Orange Mobile", "Boris Johnson", "Systems", "Huawei Technologies", "that distribute COVID vaccines", "Sprint USA", "Trudeau", "and EMF/vaccine genocide", "South Korea telecom", "T-Mobile USA", "Moderna", "LG U+", "Xi JiPing President of China; Vladimir Putin", "Indicts Pandemic defendants"], "tweets": [], "movies": [], "links": ["https://newsinsideout.com/2020/11/international-tribunal-indicts-pandemic-defendants-that-distribute-covid-vaccines-and-rollout-5g-installations-that-allegedly-cause-dna-damage-and-emf-vaccine-genocide/", "https://newsinsideout.com/2020/11/international-tribunal-indicts-pandemic-defendants-that-distribute-covid-vaccines-and-rollout-5g-installations-that-allegedly-cause-dna-damage-and-emf-vaccine-genocide/", "https://exopolitics.blogs.com/international_criminal_co/", "https://exopolitics.blogs.com/international_criminal_co/2020/11/indictment-hearing-genocide-crimes-against-humanity-by-5g-pandemic-perpetrators-parts-1-to-3.html", "https://newsinsideout.com/2020/11/international-tribunal-indicts-pandemic-defendants-that-distribute-covid-vaccines-and-rollout-5g-installations-that-allegedly-cause-dna-damage-and-emf-vaccine-genocide/", "https://exopolitics.blogs.com/international_criminal_co/", "http://www.peaceinspace.org", "http://www.truetube.co/", "https://newsinsideout.com/", "mailto:news@newsinsideout.com"], "authors": ["Alfred Lambremont Webre"], "publish_date": "2020-11-17T22:50:07+00:00"}